{"componentChunkName":"component---src-templates-layout-docs-js","path":"/docs/resources/checklist/vui","result":{"data":{"mdx":{"id":"8e05915d-af30-576b-a0e2-0cd47c519a70","body":"function _extends() { _extends = Object.assign || function (target) { for (var i = 1; i < arguments.length; i++) { var source = arguments[i]; for (var key in source) { if (Object.prototype.hasOwnProperty.call(source, key)) { target[key] = source[key]; } } } return target; }; return _extends.apply(this, arguments); }\n\nfunction _objectWithoutProperties(source, excluded) { if (source == null) return {}; var target = _objectWithoutPropertiesLoose(source, excluded); var key, i; if (Object.getOwnPropertySymbols) { var sourceSymbolKeys = Object.getOwnPropertySymbols(source); for (i = 0; i < sourceSymbolKeys.length; i++) { key = sourceSymbolKeys[i]; if (excluded.indexOf(key) >= 0) continue; if (!Object.prototype.propertyIsEnumerable.call(source, key)) continue; target[key] = source[key]; } } return target; }\n\nfunction _objectWithoutPropertiesLoose(source, excluded) { if (source == null) return {}; var target = {}; var sourceKeys = Object.keys(source); var key, i; for (i = 0; i < sourceKeys.length; i++) { key = sourceKeys[i]; if (excluded.indexOf(key) >= 0) continue; target[key] = source[key]; } return target; }\n\n/* @jsx mdx */\nvar _frontmatter = {\n  \"title\": \"Voice user interface\",\n  \"navDocTitle\": \"Voice user interface\",\n  \"path\": \"/docs/resources/checklist/vui\",\n  \"toc\": false\n};\n\nvar makeShortcode = function makeShortcode(name) {\n  return function MDXDefaultShortcode(props) {\n    console.warn(\"Component \" + name + \" was not imported, exported, or provided by MDXProvider as global scope\");\n    return mdx(\"div\", props);\n  };\n};\n\nvar InfoBox = makeShortcode(\"InfoBox\");\nvar Checkbox = makeShortcode(\"Checkbox\");\nvar layoutProps = {\n  _frontmatter: _frontmatter\n};\nvar MDXLayout = \"wrapper\";\nreturn function MDXContent(_ref) {\n  var components = _ref.components,\n      props = _objectWithoutProperties(_ref, [\"components\"]);\n\n  return mdx(MDXLayout, _extends({}, layoutProps, props, {\n    components: components,\n    mdxType: \"MDXLayout\"\n  }), mdx(InfoBox, {\n    mdxType: \"InfoBox\"\n  }, \"If you can answer with details or a simple \", mdx(\"strong\", null, \"yes\"), \" to a question, tick it. There are matching links to articles to help you find an answer if you need more information.\"), mdx(\"h2\", {\n    \"id\": \"user-experience\",\n    \"style\": {\n      \"position\": \"relative\"\n    }\n  }, mdx(\"a\", _extends({\n    parentName: \"h2\"\n  }, {\n    \"href\": \"#user-experience\",\n    \"aria-label\": \"user experience permalink\",\n    \"className\": \"anchor before\"\n  }), mdx(\"svg\", _extends({\n    parentName: \"a\"\n  }, {\n    \"aria-hidden\": \"true\",\n    \"focusable\": \"false\",\n    \"width\": \"16\",\n    \"height\": \"16\",\n    \"viewBox\": \"0 0 16 16\",\n    \"fill\": \"currentColor\",\n    \"xmlns\": \"http://www.w3.org/2000/svg\"\n  }), mdx(\"path\", _extends({\n    parentName: \"svg\"\n  }, {\n    \"d\": \"M7 4.5C7 4.77614 6.77614 5 6.5 5H4C2.34315 5 1 6.34315 1 8C1 9.65685 2.34315 11 4 11H6.5C6.77614 11 7 11.2239 7 11.5C7 11.7761 6.77614 12 6.5 12H4C1.79086 12 0 10.2091 0 8C0 5.79086 1.79086 4 4 4H6.5C6.77614 4 7 4.22386 7 4.5Z\",\n    \"fill\": \"currentColor\"\n  })), mdx(\"path\", _extends({\n    parentName: \"svg\"\n  }, {\n    \"d\": \"M9.5 5C9.22386 5 9 4.77614 9 4.5C9 4.22386 9.22386 4 9.5 4H12C14.2091 4 16 5.79086 16 8C16 10.2091 14.2091 12 12 12H9.5C9.22386 12 9 11.7761 9 11.5C9 11.2239 9.22386 11 9.5 11H12C13.6569 11 15 9.65685 15 8C15 6.34315 13.6569 5 12 5H9.5Z\",\n    \"fill\": \"currentColor\"\n  })), mdx(\"path\", _extends({\n    parentName: \"svg\"\n  }, {\n    \"d\": \"M5.5 7.5C5.22386 7.5 5 7.72386 5 8C5 8.27614 5.22386 8.5 5.5 8.5H10.5C10.7761 8.5 11 8.27614 11 8C11 7.72386 10.7761 7.5 10.5 7.5H5.5Z\",\n    \"fill\": \"currentColor\"\n  })))), \"User experience\"), mdx(Checkbox, {\n    title: \"Have you considered how the user uses the VUI?\",\n    desc: \"Find out how users interact with the voice interface to optimize the user interaction for their purpose.\",\n    mdxType: \"Checkbox\"\n  }, mdx(\"a\", {\n    href: \"/docs/fundamentals/is-conversation-the-right-fit/\",\n    target: \"_blank\"\n  }, \"Is conversation the right fit\"), mdx(\"a\", {\n    href: \"/docs/behaviour/handling-user-intents/\",\n    target: \"_blank\"\n  }, \"Handling user intents\")), mdx(Checkbox, {\n    title: \"If the VUI is location dependent, did you include this in your design process?\",\n    desc: \"Consider that many users feel uncomfortable speaking loudly to a device in front of other people, in public places or even in their own private rooms.\",\n    mdxType: \"Checkbox\"\n  }, mdx(\"a\", {\n    href: \"/docs/fundamentals/is-conversation-the-right-fit/\",\n    target: \"_blank\"\n  }, \"Is conversation the right fit\")), mdx(Checkbox, {\n    title: \"Does the use of your voice interface help the user?\",\n    desc: \"Help users by providing help at all times throughout the interaction.\",\n    mdxType: \"Checkbox\"\n  }, mdx(\"a\", {\n    href: \"/docs/behaviour/prevent-and-recover-from-errors/#help-and-documentation\",\n    target: \"_blank\"\n  }, \"Prevent and recover from-errors\")), mdx(Checkbox, {\n    title: \"Can the user always control the VUI?\",\n    desc: \"The user has control of each interaction at all times, but can also transfer control of the interaction to the system.\",\n    mdxType: \"Checkbox\"\n  }, mdx(\"a\", {\n    href: \"/docs/behaviour/freedom-of-user-control/\",\n    target: \"_blank\"\n  }, \"Freedom of user control\")), mdx(\"h2\", {\n    \"id\": \"design-patterns\",\n    \"style\": {\n      \"position\": \"relative\"\n    }\n  }, mdx(\"a\", _extends({\n    parentName: \"h2\"\n  }, {\n    \"href\": \"#design-patterns\",\n    \"aria-label\": \"design patterns permalink\",\n    \"className\": \"anchor before\"\n  }), mdx(\"svg\", _extends({\n    parentName: \"a\"\n  }, {\n    \"aria-hidden\": \"true\",\n    \"focusable\": \"false\",\n    \"width\": \"16\",\n    \"height\": \"16\",\n    \"viewBox\": \"0 0 16 16\",\n    \"fill\": \"currentColor\",\n    \"xmlns\": \"http://www.w3.org/2000/svg\"\n  }), mdx(\"path\", _extends({\n    parentName: \"svg\"\n  }, {\n    \"d\": \"M7 4.5C7 4.77614 6.77614 5 6.5 5H4C2.34315 5 1 6.34315 1 8C1 9.65685 2.34315 11 4 11H6.5C6.77614 11 7 11.2239 7 11.5C7 11.7761 6.77614 12 6.5 12H4C1.79086 12 0 10.2091 0 8C0 5.79086 1.79086 4 4 4H6.5C6.77614 4 7 4.22386 7 4.5Z\",\n    \"fill\": \"currentColor\"\n  })), mdx(\"path\", _extends({\n    parentName: \"svg\"\n  }, {\n    \"d\": \"M9.5 5C9.22386 5 9 4.77614 9 4.5C9 4.22386 9.22386 4 9.5 4H12C14.2091 4 16 5.79086 16 8C16 10.2091 14.2091 12 12 12H9.5C9.22386 12 9 11.7761 9 11.5C9 11.2239 9.22386 11 9.5 11H12C13.6569 11 15 9.65685 15 8C15 6.34315 13.6569 5 12 5H9.5Z\",\n    \"fill\": \"currentColor\"\n  })), mdx(\"path\", _extends({\n    parentName: \"svg\"\n  }, {\n    \"d\": \"M5.5 7.5C5.22386 7.5 5 7.72386 5 8C5 8.27614 5.22386 8.5 5.5 8.5H10.5C10.7761 8.5 11 8.27614 11 8C11 7.72386 10.7761 7.5 10.5 7.5H5.5Z\",\n    \"fill\": \"currentColor\"\n  })))), \"Design Patterns\"), mdx(Checkbox, {\n    title: \"Does the VUI provide shortcuts to users to improve the conversation?\",\n    desc: \"Improve user task efficiency by providing links like chips. Contrary to pronouncing user intent, this can be a useful and faster alternative.\",\n    mdxType: \"Checkbox\"\n  }, mdx(\"a\", {\n    href: \"/docs/behaviour/handling-user-intents/\",\n    target: \"_blank\"\n  }, \"Handling user inputs\"), mdx(\"a\", {\n    href: \"/docs/design-patterns/chip/\",\n    target: \"_blank\"\n  }, \"Chip\")), mdx(Checkbox, {\n    title: \"Does the VUI use any design patterns and are they used correctly?\",\n    desc: \"Use design patterns correctly to solve common design problems.\",\n    mdxType: \"Checkbox\"\n  }, mdx(\"a\", {\n    href: \"/docs/design-patterns/card/\",\n    target: \"_blank\"\n  }, \"Card\"), mdx(\"a\", {\n    href: \"/docs/design-patterns/carousel/\",\n    target: \"_blank\"\n  }, \"Carousel\"), mdx(\"a\", {\n    href: \"/docs/design-patterns/lsit/\",\n    target: \"_blank\"\n  }, \"List\"), mdx(\"a\", {\n    href: \"/docs/design-patterns/chip/\",\n    target: \"_blank\"\n  }, \"Chip\"), mdx(\"a\", {\n    href: \"/docs/design-patterns/table/\",\n    target: \"_blank\"\n  }, \"Table\"), mdx(\"a\", {\n    href: \"/docs/design-patterns/audio-card/\",\n    target: \"_blank\"\n  }, \"Audio card\")), mdx(\"h2\", {\n    \"id\": \"communication\",\n    \"style\": {\n      \"position\": \"relative\"\n    }\n  }, mdx(\"a\", _extends({\n    parentName: \"h2\"\n  }, {\n    \"href\": \"#communication\",\n    \"aria-label\": \"communication permalink\",\n    \"className\": \"anchor before\"\n  }), mdx(\"svg\", _extends({\n    parentName: \"a\"\n  }, {\n    \"aria-hidden\": \"true\",\n    \"focusable\": \"false\",\n    \"width\": \"16\",\n    \"height\": \"16\",\n    \"viewBox\": \"0 0 16 16\",\n    \"fill\": \"currentColor\",\n    \"xmlns\": \"http://www.w3.org/2000/svg\"\n  }), mdx(\"path\", _extends({\n    parentName: \"svg\"\n  }, {\n    \"d\": \"M7 4.5C7 4.77614 6.77614 5 6.5 5H4C2.34315 5 1 6.34315 1 8C1 9.65685 2.34315 11 4 11H6.5C6.77614 11 7 11.2239 7 11.5C7 11.7761 6.77614 12 6.5 12H4C1.79086 12 0 10.2091 0 8C0 5.79086 1.79086 4 4 4H6.5C6.77614 4 7 4.22386 7 4.5Z\",\n    \"fill\": \"currentColor\"\n  })), mdx(\"path\", _extends({\n    parentName: \"svg\"\n  }, {\n    \"d\": \"M9.5 5C9.22386 5 9 4.77614 9 4.5C9 4.22386 9.22386 4 9.5 4H12C14.2091 4 16 5.79086 16 8C16 10.2091 14.2091 12 12 12H9.5C9.22386 12 9 11.7761 9 11.5C9 11.2239 9.22386 11 9.5 11H12C13.6569 11 15 9.65685 15 8C15 6.34315 13.6569 5 12 5H9.5Z\",\n    \"fill\": \"currentColor\"\n  })), mdx(\"path\", _extends({\n    parentName: \"svg\"\n  }, {\n    \"d\": \"M5.5 7.5C5.22386 7.5 5 7.72386 5 8C5 8.27614 5.22386 8.5 5.5 8.5H10.5C10.7761 8.5 11 8.27614 11 8C11 7.72386 10.7761 7.5 10.5 7.5H5.5Z\",\n    \"fill\": \"currentColor\"\n  })))), \"Communication\"), mdx(Checkbox, {\n    title: \"Does your VUI provide conversation status feedback?\",\n    desc: \"Communicate currently available options or errors while interacting with the voice interface.\",\n    mdxType: \"Checkbox\"\n  }, mdx(\"a\", {\n    href: \"/docs/behaviour/feedback-of-conversation-status/\",\n    target: \"_blank\"\n  }, \"Feedback of conversation status\")), mdx(Checkbox, {\n    title: \"Does your VUI speak simple language?\",\n    desc: \"Use everyday language and avoid technical jargon as this only confuses the user.\",\n    mdxType: \"Checkbox\"\n  }, mdx(\"a\", {\n    href: \"/docs/behaviour/behaviour-of-speak/#do-what-humans-already-do\",\n    target: \"_blank\"\n  }, \"Behaviour of speak\"), mdx(\"a\", {\n    href: \"/docs/behaviour/wording/\",\n    target: \"_blank\"\n  }, \"Wording\")), mdx(Checkbox, {\n    title: \"Does the VUI help the user to remember conversations?\",\n    desc: \"Users should always be able to remember voice commands. Wherever possible, show the user which interaction leads to which result.\",\n    mdxType: \"Checkbox\"\n  }, mdx(\"a\", {\n    href: \"/docs/behaviour/prevent-and-recover-from-errors/\",\n    target: \"_blank\"\n  }, \"Help users recognize, diagnose, and recover from errors\")), mdx(Checkbox, {\n    title: \"Does the VUI minimize the amount of information in dialogue and design?\",\n    desc: \"Minimize the amount of information that is communicated to the user.\",\n    mdxType: \"Checkbox\"\n  }, mdx(\"a\", {\n    href: \"/docs/behaviour/behaviour-of-speak/\",\n    target: \"_blank\"\n  }, \"Behaviour of speak\")));\n}\n;\nMDXContent.isMDXComponent = true;","tableOfContents":{"items":[{"url":"#user-experience","title":"User experience"},{"url":"#design-patterns","title":"Design Patterns"},{"url":"#communication","title":"Communication"}]},"frontmatter":{"category":null,"title":"Voice user interface","navDocTitle":"Voice user interface","toc":false}}},"pageContext":{"id":"8e05915d-af30-576b-a0e2-0cd47c519a70","breadcrumb":{"location":"/docs/resources/checklist/vui","crumbs":[{"pathname":"/","crumbLabel":"Home"},{"pathname":"/docs","crumbLabel":"Docs"},{"pathname":"/docs/resources","crumbLabel":"Resources"},{"pathname":"/docs/resources/checklist","crumbLabel":"Checklist"},{"pathname":"/docs/resources/checklist/vui","crumbLabel":"vui"}]}}}}