{"componentChunkName":"component---src-templates-layout-docs-js","path":"/docs/","result":{"data":{"mdx":{"id":"6c6a86f1-bb34-5a27-bced-cf29e64815b9","body":"function _extends() { _extends = Object.assign || function (target) { for (var i = 1; i < arguments.length; i++) { var source = arguments[i]; for (var key in source) { if (Object.prototype.hasOwnProperty.call(source, key)) { target[key] = source[key]; } } } return target; }; return _extends.apply(this, arguments); }\n\nfunction _objectWithoutProperties(source, excluded) { if (source == null) return {}; var target = _objectWithoutPropertiesLoose(source, excluded); var key, i; if (Object.getOwnPropertySymbols) { var sourceSymbolKeys = Object.getOwnPropertySymbols(source); for (i = 0; i < sourceSymbolKeys.length; i++) { key = sourceSymbolKeys[i]; if (excluded.indexOf(key) >= 0) continue; if (!Object.prototype.propertyIsEnumerable.call(source, key)) continue; target[key] = source[key]; } } return target; }\n\nfunction _objectWithoutPropertiesLoose(source, excluded) { if (source == null) return {}; var target = {}; var sourceKeys = Object.keys(source); var key, i; for (i = 0; i < sourceKeys.length; i++) { key = sourceKeys[i]; if (excluded.indexOf(key) >= 0) continue; target[key] = source[key]; } return target; }\n\n/* @jsx mdx */\nvar _frontmatter = {\n  \"title\": \"Docs\",\n  \"navDocTitle\": \"Introduction\",\n  \"path\": \"/docs/\",\n  \"toc\": false\n};\n\nvar makeShortcode = function makeShortcode(name) {\n  return function MDXDefaultShortcode(props) {\n    console.warn(\"Component \" + name + \" was not imported, exported, or provided by MDXProvider as global scope\");\n    return mdx(\"div\", props);\n  };\n};\n\nvar Link = makeShortcode(\"Link\");\nvar layoutProps = {\n  _frontmatter: _frontmatter\n};\nvar MDXLayout = \"wrapper\";\nreturn function MDXContent(_ref) {\n  var components = _ref.components,\n      props = _objectWithoutProperties(_ref, [\"components\"]);\n\n  return mdx(MDXLayout, _extends({}, layoutProps, props, {\n    components: components,\n    mdxType: \"MDXLayout\"\n  }), mdx(\"p\", null, \"The emerge of Voice User Interfaces (VUIs) is a big change in human-computer interaction. Controlling devices via touch subside or disappears entirely because voice interfaces are mainly operated via voice. The design of voice user interfaces has changed fundamentally from designing apps for graphical user interfaces (GUI).\"), mdx(\"p\", null, \"This leads to new questions and an upcoming challenge for UI-/UX-Designers: \\u201CHow do designers design voice interfaces for optimal user guidance?\\u201D, \\u201CWhat visual elements are available to me as a designer to support acoustic elements?\\u201D or \\u201CHow does the user\\u2019s environment influence my design and user guidance?\\u201D and so on.\"), mdx(\"h2\", {\n    \"id\": \"how-to-use-this-guide\",\n    \"style\": {\n      \"position\": \"relative\"\n    }\n  }, mdx(\"a\", _extends({\n    parentName: \"h2\"\n  }, {\n    \"href\": \"#how-to-use-this-guide\",\n    \"aria-label\": \"how to use this guide permalink\",\n    \"className\": \"anchor before\"\n  }), mdx(\"svg\", _extends({\n    parentName: \"a\"\n  }, {\n    \"aria-hidden\": \"true\",\n    \"focusable\": \"false\",\n    \"width\": \"16\",\n    \"height\": \"16\",\n    \"viewBox\": \"0 0 16 16\",\n    \"fill\": \"currentColor\",\n    \"xmlns\": \"http://www.w3.org/2000/svg\"\n  }), mdx(\"path\", _extends({\n    parentName: \"svg\"\n  }, {\n    \"d\": \"M7 4.5C7 4.77614 6.77614 5 6.5 5H4C2.34315 5 1 6.34315 1 8C1 9.65685 2.34315 11 4 11H6.5C6.77614 11 7 11.2239 7 11.5C7 11.7761 6.77614 12 6.5 12H4C1.79086 12 0 10.2091 0 8C0 5.79086 1.79086 4 4 4H6.5C6.77614 4 7 4.22386 7 4.5Z\",\n    \"fill\": \"currentColor\"\n  })), mdx(\"path\", _extends({\n    parentName: \"svg\"\n  }, {\n    \"d\": \"M9.5 5C9.22386 5 9 4.77614 9 4.5C9 4.22386 9.22386 4 9.5 4H12C14.2091 4 16 5.79086 16 8C16 10.2091 14.2091 12 12 12H9.5C9.22386 12 9 11.7761 9 11.5C9 11.2239 9.22386 11 9.5 11H12C13.6569 11 15 9.65685 15 8C15 6.34315 13.6569 5 12 5H9.5Z\",\n    \"fill\": \"currentColor\"\n  })), mdx(\"path\", _extends({\n    parentName: \"svg\"\n  }, {\n    \"d\": \"M5.5 7.5C5.22386 7.5 5 7.72386 5 8C5 8.27614 5.22386 8.5 5.5 8.5H10.5C10.7761 8.5 11 8.27614 11 8C11 7.72386 10.7761 7.5 10.5 7.5H5.5Z\",\n    \"fill\": \"currentColor\"\n  })))), \"How to use this guide\"), mdx(\"p\", null, \"vui.guide is divided into two areas, a design and a contribute part. As a designer use the design part to create voice user interface and use the contribute part to make a contribution to improve the guide.\"), mdx(\"h3\", {\n    \"id\": \"as-a-designer\",\n    \"style\": {\n      \"position\": \"relative\"\n    }\n  }, mdx(\"a\", _extends({\n    parentName: \"h3\"\n  }, {\n    \"href\": \"#as-a-designer\",\n    \"aria-label\": \"as a designer permalink\",\n    \"className\": \"anchor before\"\n  }), mdx(\"svg\", _extends({\n    parentName: \"a\"\n  }, {\n    \"aria-hidden\": \"true\",\n    \"focusable\": \"false\",\n    \"width\": \"16\",\n    \"height\": \"16\",\n    \"viewBox\": \"0 0 16 16\",\n    \"fill\": \"currentColor\",\n    \"xmlns\": \"http://www.w3.org/2000/svg\"\n  }), mdx(\"path\", _extends({\n    parentName: \"svg\"\n  }, {\n    \"d\": \"M7 4.5C7 4.77614 6.77614 5 6.5 5H4C2.34315 5 1 6.34315 1 8C1 9.65685 2.34315 11 4 11H6.5C6.77614 11 7 11.2239 7 11.5C7 11.7761 6.77614 12 6.5 12H4C1.79086 12 0 10.2091 0 8C0 5.79086 1.79086 4 4 4H6.5C6.77614 4 7 4.22386 7 4.5Z\",\n    \"fill\": \"currentColor\"\n  })), mdx(\"path\", _extends({\n    parentName: \"svg\"\n  }, {\n    \"d\": \"M9.5 5C9.22386 5 9 4.77614 9 4.5C9 4.22386 9.22386 4 9.5 4H12C14.2091 4 16 5.79086 16 8C16 10.2091 14.2091 12 12 12H9.5C9.22386 12 9 11.7761 9 11.5C9 11.2239 9.22386 11 9.5 11H12C13.6569 11 15 9.65685 15 8C15 6.34315 13.6569 5 12 5H9.5Z\",\n    \"fill\": \"currentColor\"\n  })), mdx(\"path\", _extends({\n    parentName: \"svg\"\n  }, {\n    \"d\": \"M5.5 7.5C5.22386 7.5 5 7.72386 5 8C5 8.27614 5.22386 8.5 5.5 8.5H10.5C10.7761 8.5 11 8.27614 11 8C11 7.72386 10.7761 7.5 10.5 7.5H5.5Z\",\n    \"fill\": \"currentColor\"\n  })))), \"As a designer\"), mdx(\"p\", null, \"Navigate through the guide with the menu bar on the left. There is a resource area with useful tools and a \", mdx(Link, {\n    to: \"/docs/resources/checklist/\",\n    mdxType: \"Link\"\n  }, \"checklist\"), \" that gives you an overview of the most important points and helps you step by step in creating a design for a voice user interface.\"), mdx(\"h3\", {\n    \"id\": \"as-a-contributor\",\n    \"style\": {\n      \"position\": \"relative\"\n    }\n  }, mdx(\"a\", _extends({\n    parentName: \"h3\"\n  }, {\n    \"href\": \"#as-a-contributor\",\n    \"aria-label\": \"as a contributor permalink\",\n    \"className\": \"anchor before\"\n  }), mdx(\"svg\", _extends({\n    parentName: \"a\"\n  }, {\n    \"aria-hidden\": \"true\",\n    \"focusable\": \"false\",\n    \"width\": \"16\",\n    \"height\": \"16\",\n    \"viewBox\": \"0 0 16 16\",\n    \"fill\": \"currentColor\",\n    \"xmlns\": \"http://www.w3.org/2000/svg\"\n  }), mdx(\"path\", _extends({\n    parentName: \"svg\"\n  }, {\n    \"d\": \"M7 4.5C7 4.77614 6.77614 5 6.5 5H4C2.34315 5 1 6.34315 1 8C1 9.65685 2.34315 11 4 11H6.5C6.77614 11 7 11.2239 7 11.5C7 11.7761 6.77614 12 6.5 12H4C1.79086 12 0 10.2091 0 8C0 5.79086 1.79086 4 4 4H6.5C6.77614 4 7 4.22386 7 4.5Z\",\n    \"fill\": \"currentColor\"\n  })), mdx(\"path\", _extends({\n    parentName: \"svg\"\n  }, {\n    \"d\": \"M9.5 5C9.22386 5 9 4.77614 9 4.5C9 4.22386 9.22386 4 9.5 4H12C14.2091 4 16 5.79086 16 8C16 10.2091 14.2091 12 12 12H9.5C9.22386 12 9 11.7761 9 11.5C9 11.2239 9.22386 11 9.5 11H12C13.6569 11 15 9.65685 15 8C15 6.34315 13.6569 5 12 5H9.5Z\",\n    \"fill\": \"currentColor\"\n  })), mdx(\"path\", _extends({\n    parentName: \"svg\"\n  }, {\n    \"d\": \"M5.5 7.5C5.22386 7.5 5 7.72386 5 8C5 8.27614 5.22386 8.5 5.5 8.5H10.5C10.7761 8.5 11 8.27614 11 8C11 7.72386 10.7761 7.5 10.5 7.5H5.5Z\",\n    \"fill\": \"currentColor\"\n  })))), \"As a contributor\"), mdx(\"p\", null, \"vui.guide is open source and licensed under a \", mdx(\"a\", _extends({\n    parentName: \"p\"\n  }, {\n    \"href\": \"https://github.com/larsmaeder/vui.guide#-license\"\n  }), \"MIT\"), \" and \", mdx(\"a\", _extends({\n    parentName: \"p\"\n  }, {\n    \"href\": \"https://github.com/larsmaeder/vui.guide#-license\"\n  }), \"CC BY-SA 4.0 license\"), \". Add new or edit existing articles, share your knowledge with others and edit existing articles to become a part of the voice user interface guide. \"), mdx(\"h2\", {\n    \"id\": \"start-contribution\",\n    \"style\": {\n      \"position\": \"relative\"\n    }\n  }, mdx(\"a\", _extends({\n    parentName: \"h2\"\n  }, {\n    \"href\": \"#start-contribution\",\n    \"aria-label\": \"start contribution permalink\",\n    \"className\": \"anchor before\"\n  }), mdx(\"svg\", _extends({\n    parentName: \"a\"\n  }, {\n    \"aria-hidden\": \"true\",\n    \"focusable\": \"false\",\n    \"width\": \"16\",\n    \"height\": \"16\",\n    \"viewBox\": \"0 0 16 16\",\n    \"fill\": \"currentColor\",\n    \"xmlns\": \"http://www.w3.org/2000/svg\"\n  }), mdx(\"path\", _extends({\n    parentName: \"svg\"\n  }, {\n    \"d\": \"M7 4.5C7 4.77614 6.77614 5 6.5 5H4C2.34315 5 1 6.34315 1 8C1 9.65685 2.34315 11 4 11H6.5C6.77614 11 7 11.2239 7 11.5C7 11.7761 6.77614 12 6.5 12H4C1.79086 12 0 10.2091 0 8C0 5.79086 1.79086 4 4 4H6.5C6.77614 4 7 4.22386 7 4.5Z\",\n    \"fill\": \"currentColor\"\n  })), mdx(\"path\", _extends({\n    parentName: \"svg\"\n  }, {\n    \"d\": \"M9.5 5C9.22386 5 9 4.77614 9 4.5C9 4.22386 9.22386 4 9.5 4H12C14.2091 4 16 5.79086 16 8C16 10.2091 14.2091 12 12 12H9.5C9.22386 12 9 11.7761 9 11.5C9 11.2239 9.22386 11 9.5 11H12C13.6569 11 15 9.65685 15 8C15 6.34315 13.6569 5 12 5H9.5Z\",\n    \"fill\": \"currentColor\"\n  })), mdx(\"path\", _extends({\n    parentName: \"svg\"\n  }, {\n    \"d\": \"M5.5 7.5C5.22386 7.5 5 7.72386 5 8C5 8.27614 5.22386 8.5 5.5 8.5H10.5C10.7761 8.5 11 8.27614 11 8C11 7.72386 10.7761 7.5 10.5 7.5H5.5Z\",\n    \"fill\": \"currentColor\"\n  })))), \"Start contribution\"), mdx(\"p\", null, \"Visit the \", mdx(Link, {\n    to: \"/contribute/\",\n    mdxType: \"Link\"\n  }, \"contribute\"), \" section for instructions on how to start contributing to the voice user interface guide.\"));\n}\n;\nMDXContent.isMDXComponent = true;","tableOfContents":{"items":[{"url":"#how-to-use-this-guide","title":"How to use this guide"},{"url":"#start-contribution","title":"Start contribution"}]},"frontmatter":{"category":null,"title":"Docs","navDocTitle":"Introduction","toc":false}}},"pageContext":{"id":"6c6a86f1-bb34-5a27-bced-cf29e64815b9","breadcrumb":{"location":"/docs/","crumbs":[{"pathname":"/","crumbLabel":"Home"},{"pathname":"/docs","crumbLabel":"Docs"}]}}}}